<?xml version="1.0" encoding="UTF-8"?>
<!DOCTYPE company SYSTEM "employee.dtd">
<company>
    <name>IT-Heaven</name>
    <!-- Иван недавно уволился, только неделю отработать должен. Не забудьте потом удалить его из списка.-->
    <offices>
        <office floor="1" room="1">
            <employees>
                <employee name="&M;" job="Middle Software Developer" />
                <employee name="&I;" job="Junior Software Developer" />
                <employee name="&F;" job="Junior Software Developer" />
            </employees>
        </office>
        <office floor="1" room="2">
            <employees>
                <employee name="Herald" job="Middle Software Developer" />
                <employee name="Adam" job="Middle Software Developer" />
                <employee name="Leroy" job="Junior Software Developer" />
            </employees>
        </office>
    </offices>
</company>
